"This evolution is based on the use of an external tool that allows for the analysis of both acute risks (river and rain flooding, tropical cyclones, wildfires, heat and cold waves)..."
"To assess the physical risks related to climate change, La Banque Postale has carried out risk mapping work. It has defined these risks, measured their impact and their probability of occurrence on the basis of indicators specific to its portfolios and its operational scope, in particular using the quantification of reference physical risk scenarios over short-, medium- and long-term horizons."
"To calculate the portion financed by the Bank, most standards, including the FBF, recommend using the enterprise value, which makes it the most common approach. As enterprise value is difficult to collect, revenue is currently the data used."
"To determine the preliminary results of the assessment the bank translated the qualitative evaluations into quantitative scores. The materiality threshold was set at 3 minimum on a five-point scale, including a materiality threshold corridor of... Furthermore, the preliminary results of the assessment were discussed in structured validation interviews with seven senior validation managers concentrating on topics positioned in the materiality threshold corridor."
"To this end, specific analyses and monitoring of exposures are carried out to assess the materiality of the risk factors identified, maintaining a close connection with the qualitative assessments adopted: by the Bank at sector and sub-sector level (e.g. ESG Sectoral Assessment) for credit risk purposes; for the valuation of government securities for market risk purposes."
"True"
"Type of physical risk (Acute/Chronic) Material physical risk hazard Event Acute Aridity Probability of aridity phenomena (ratio precipitation/evaporation), predictive model"
"UniCredit included in Template 5 information on exposures in the banking book exposed to chronic and acute climate-related hazards, leveraging on following process: Selection of material physical hazard events...Two different methodologies have been defined to assess the physical risk score depending on the disclosure level (collateral or counterparty)..."
"Value at risk"
"Value at Risk (VaR) is a probability-based metric that expresses the maximum potential loss of portfolio value that could be incurred within a specific time horizon, at a pre-defined confidence level. VaR is also used to consolidate exposure to financial risks of the various Group companies which perform banking book activities, also taking into account the benefits of diversification and the correlation between various risk factors and different currencies."
"Wildfires"
"wildfires, heat stress, water stress, hurricanes and typhoons and sea level rise from Moody's"
"With regard to credit risk , the qualitative component of the models currently validated and used by the Group considers various ESG and Climate-related aspects and elements. For Large Corporates, a specific module has also been incorporated into the model that considers quantitative ESG data provided by external providers, and for the Corporate model (companies or groups with a size of less than 500 million euro), an ad hoc module has been developed – in addition to the qualitative questions that also consider socio-environmental risks, to take account of the counterparty’s exposure to physical risks arising from catastrophic events (e.g. damage to production facilities and/or warehouses) – that statistically identifies potential deteriorations in the Probability of Default, using historic and public information on catastrophic events observed at geographic area level."
"with regard to the broader category and the transmission channels of environmental risks, where the main sources of risk for Intesa Sanpaolo’s counterparties and, consequently, for the Group arise from: impacts on nature: changes in the state (quality and quantity) of natural capital caused by an organisation’s activities that may result in changes in nature’s ability to provide social and economic functions. Impacts can be positive or negative"
"Within the ESG & Reputational Risk Clearing process, particular importance is also given to the application of the Equator Principles, which are international guidelines, for all countries and all industrial sectors, applicable to the financing of infrastructure and industrial projects (e.g. power plants, petrochemical plants, mines, transport and telecommunications infrastructure) that due to their nature may have adverse effects on people and the environment."
